{
    "$schema": "http://json-schema.org/draft-07/schema#",
    "$id": "https://github.com/oharkins/personal-cookbook/schemas/recipes.schema.json",
    "title": "Recipe Specification",
    "description": "This file is used to validate whether a given document meets the recipe specification.",
    "type": "object",
    "properties": {
      "author": {
        "type": "string",
        "description": "Name of the recipe author"
      },
      "recipe": {
        "type": "string",
        "description": "Title of the recipe"
      },
      "source": {
        "type": "string",
        "description": "Source URL of the recipe"
      },
      "tags": {
        "type": "string",
        "description": "Comma-separated list of tags"
      },
      "servings": {
        "type": "number",
        "description": "Nominal number of servings created"
      },
      "yield": {
        "type": "string",
        "description": "Specific yield amount (e.g., 'makes 24 cookies')"
      },
      "difficulty": {
        "type": "string",
        "description": "Recipe difficulty level",
        "enum": ["beginner", "intermediate", "advanced"]
      },
      "cuisine": {
        "type": "string",
        "description": "Type of cuisine (e.g., Italian, Mexican, Japanese)"
      },
      "dietaryRestrictions": {
        "type": "array",
        "description": "List of dietary restrictions",
        "items": {
          "type": "string",
          "enum": [
            "vegetarian",
            "vegan",
            "gluten-free",
            "dairy-free",
            "nut-free",
            "kosher",
            "halal",
            "keto",
            "paleo",
            "low-carb"
          ]
        }
      },
      "temperatureUnit": {
        "type": "string",
        "description": "Unit system for temperature measurements",
        "enum": ["celsius", "fahrenheit"],
        "default": "celsius"
      },
      "totalTime": {
        "$ref": "#/definitions/time",
        "description": "Total time to complete the recipe"
      },
      "storage": {
        "type": "string",
        "description": "Instructions for storing leftovers"
      },
      "nutrition": {
        "type": "object",
        "description": "Nutritional information per serving",
        "properties": {
          "calories": {
            "type": "number",
            "description": "Calories per serving"
          },
          "protein": {
            "type": "number",
            "description": "Protein in grams per serving"
          },
          "carbohydrates": {
            "type": "number",
            "description": "Carbohydrates in grams per serving"
          },
          "fat": {
            "type": "number",
            "description": "Fat in grams per serving"
          },
          "fiber": {
            "type": "number",
            "description": "Fiber in grams per serving"
          },
          "sugar": {
            "type": "number",
            "description": "Sugar in grams per serving"
          },
          "sodium": {
            "type": "number",
            "description": "Sodium in milligrams per serving"
          }
        }
      },
      "allIngredients": {
        "type": "array",
        "description": "Complete list of all ingredients needed",
        "items": {
          "$ref": "#/definitions/ingredient"
        }
      },
      "allEquipment": {
        "type": "array",
        "description": "Complete list of all equipment needed",
        "items": {
          "$ref": "#/definitions/equipment"
        }
      },
      "prelude": {
        "type": "object",
        "description": "Content that appears above the recipe",
        "properties": {
          "description": {
            "type": "string",
            "description": "Introductory information."
          },
          "images": {
            "type": "array",
            "items": {
              "$ref": "#/definitions/image"
            }
          },
          "videos": {
            "type": "array",
            "items": {
              "$ref": "#/definitions/video"
            }
          }
        },
        "required": [
          "description"
        ]
      },
      "preheat": {
        "type": "number",
        "description": "The temperature to set the oven prior to beginning the steps, in Celcius"
      },
      "steps": {
        "type": "array",
        "description": "Array containing steps to complete the recipe",
        "items": {
          "$ref": "#/definitions/step"
        }
      }
    },
    "required": [
      "author", "recipe", "tags", "servings"
    ],
    "definitions": {
      "equipment": {
        "type": "object",
        "description": "Equipment are non-consumable items used in a recipe",
        "properties": {
          "item": {
            "type": "string",
            "description": "The title of the item"
          }
        }
      },
      "image": {
        "type": "object",
        "properties": {
          "src": {
            "type": "string",
            "description": "URL pointing to the image"
          },
          "description": {
            "type": "string",
            "description": "Caption for the image"
          }
        },
        "required": [
          "src"
        ]
      },
      "ingredient": {
        "type": "object",
        "description": "An ingredient is a consumable good used in a recipe",
        "properties": {
          "item": {
            "type": "string",
            "description": "The title of the item"
          },
          "amount": {
            "type": "number",
            "description": "The amount of the given ingredient to use. Use this if the amount is absolute."
          },
          "min": {
            "type": "number",
            "description": "The lower end of a range for the amount of an ingredient to use."
          },
          "max": {
            "type": "number",
            "description": "The upper end of a range for the amount of an ingredient to use."
          },
          "unit": {
            "type": "string",
            "description": "A measurement of the ingredient",
            "enum": [
              "cup", "cups",
              "tablespoon", "tablespoons", "tbsp",
              "teaspoon", "teaspoons", "tsp",
              "pound", "pounds", "lb", "lbs",
              "ounce", "ounces", "oz",
              "whole",
              "pinch",
              "dash", "dashes",
              "to taste",
              "clove", "cloves",
              "piece", "pieces",
              "slice", "slices",
              "can", "cans",
              "jar", "jars",
              "bottle", "bottles",
              "package", "packages",
              "box", "boxes",
              "bag", "bags",
              "head", "heads",
              "bunch", "bunches",
              "stalk", "stalks",
              "sprig", "sprigs",
              "leaf", "leaves",
              "stick", "sticks",
              "bar", "bars",
              "block", "blocks",
              "sheet", "sheets",
              "roll", "rolls",
              "rack", "racks",
              "tube", "tubes",
              "container", "containers",
              "packet", "packets",
              "envelope", "envelopes",
              "carton", "cartons",
              "quart", "quarts",
              "pint", "pints",
              "fluid ounce", "fluid ounces", "fl oz",
              "gallon", "gallons",
              "milliliter", "milliliters", "ml",
              "liter", "liters", "l",
              "gram", "grams", "g",
              "kilogram", "kilograms", "kg",
              "milligram", "milligrams", "mg",
              "minute", "minutes", "min",
              "hour", "hours", "hr",
              "day", "days",
              "week", "weeks",
              "month", "months",
              "year", "years",
              "small", "medium", "large", "extra large"
            ]
          }
        },
        "required": [
          "item"
        ]
      },
      "step": {
        "type": "object",
        "description": "A unit of cooking",
        "properties": {
          "description": {
            "type": "string",
            "description": "Human-readable instruction unit"
          },
          "ingredients": {
            "type": "array",
            "description": "List of ingredients uniquely introduced in this step",
            "items": {
              "$ref": "#/definitions/ingredient"
            }
          },
          "equipment": {
            "type": "array",
            "description": "List of equipment uniquely introduced in this step",
            "items": {
              "$ref": "#/definitions/equipment"
            }
          },
          "prepTime": {
            "$ref": "#/definitions/time",
            "description": "The amount of time for indirect actions"
          },
          "cookTime": {
            "$ref": "#/definitions/time",
            "description": "The amount of time for direct actions"
          },
          "images": {
            "type": "array",
            "description": "Images for the given step",
            "items": {
              "$ref": "#/definitions/image"
            }
          },
          "optional": {
            "type": "boolean",
            "description": "Whether this step is fundamental to the recipe"
          }
        },
        "required": [
          "description"
        ]
      },
      "time": {
        "type": "object",
        "description": "A representation of time",
        "properties": {
          "amount": {
            "type": "number",
            "description": "Numerical time"
          },
          "unit": {
            "type": "string",
            "description": "Unit for time measurement",
            "enum": [
              "minute", "minutes", "min", "m",
              "second", "seconds", "sec", "s",
              "hour", "hours", "hr", "h"
            ]
          }
        },
        "required": [
          "amount", "unit"
        ]
      },
      "video": {
        "type": "object",
        "properties": {
          "youtube": {
            "type": "string",
            "description": "For YouTube videos, supply the video ID"
          }
        }
      }
    }
  }