{
  "author": "The Kitchn",
  "recipe": "Breakfast Burrito",
  "source": "https://www.thekitchn.com/breakfast-burrito-recipe-23607841",
  "tags": "breakfast, mexican, eggs, burrito, quick-meal",
  "servings": 4,
  "yield": "4 burritos",
  "difficulty": "beginner",
  "cuisine": "Mexican-American",
  "dietaryRestrictions": ["vegetarian"],
  "temperatureUnit": "fahrenheit",
  "totalTime": {
    "amount": 30,
    "unit": "minutes"
  },
  "nutrition": {
    "calories": 450,
    "protein": 20,
    "carbohydrates": 35,
    "fat": 25,
    "fiber": 8,
    "sugar": 2,
    "sodium": 800
  },
  "allIngredients": [
    {
      "item": "large eggs",
      "amount": 8,
      "unit": "whole"
    },
    {
      "item": "kosher salt",
      "amount": 0.5,
      "unit": "teaspoon"
    },
    {
      "item": "freshly ground black pepper",
      "amount": 0.25,
      "unit": "teaspoon"
    },
    {
      "item": "unsalted butter",
      "amount": 2,
      "unit": "tablespoons"
    },
    {
      "item": "large flour tortillas",
      "amount": 4,
      "unit": "whole"
    },
    {
      "item": "shredded cheese",
      "amount": 1,
      "unit": "cup"
    },
    {
      "item": "cooked breakfast sausage",
      "amount": 1,
      "unit": "cup"
    },
    {
      "item": "diced bell peppers",
      "amount": 1,
      "unit": "cup"
    },
    {
      "item": "diced onions",
      "amount": 0.5,
      "unit": "cup"
    },
    {
      "item": "salsa",
      "amount": 0.5,
      "unit": "cup"
    }
  ],
  "allEquipment": [
    {
      "item": "large nonstick skillet"
    },
    {
      "item": "mixing bowl"
    },
    {
      "item": "whisk"
    },
    {
      "item": "spatula"
    },
    {
      "item": "microwave-safe plate"
    }
  ],
  "prelude": {
    "description": "A hearty and satisfying breakfast burrito filled with scrambled eggs, cheese, sausage, and vegetables. Perfect for a quick breakfast or brunch.",
    "images": [
      {
        "src": "https://www.thekitchn.com/breakfast-burrito-recipe-23607841",
        "description": "Finished breakfast burrito with melted cheese and fresh ingredients"
      }
    ]
  },
  "steps": [
    {
      "description": "In a large mixing bowl, whisk together the eggs, salt, and pepper until well combined.",
      "ingredients": [
        {
          "item": "large eggs",
          "amount": 8,
          "unit": "whole"
        },
        {
          "item": "kosher salt",
          "amount": 0.5,
          "unit": "teaspoon"
        },
        {
          "item": "freshly ground black pepper",
          "amount": 0.25,
          "unit": "teaspoon"
        }
      ],
      "equipment": [
        {
          "item": "mixing bowl"
        },
        {
          "item": "whisk"
        }
      ],
      "prepTime": {
        "amount": 5,
        "unit": "minutes"
      }
    },
    {
      "description": "Heat a large nonstick skillet over medium heat. Add the butter and let it melt.",
      "ingredients": [
        {
          "item": "unsalted butter",
          "amount": 2,
          "unit": "tablespoons"
        }
      ],
      "equipment": [
        {
          "item": "large nonstick skillet"
        }
      ],
      "cookTime": {
        "amount": 2,
        "unit": "minutes"
      }
    },
    {
      "description": "Add the diced bell peppers and onions to the skillet and cook until softened, about 5 minutes.",
      "ingredients": [
        {
          "item": "diced bell peppers",
          "amount": 1,
          "unit": "cup"
        },
        {
          "item": "diced onions",
          "amount": 0.5,
          "unit": "cup"
        }
      ],
      "cookTime": {
        "amount": 5,
        "unit": "minutes"
      }
    },
    {
      "description": "Add the cooked breakfast sausage to the skillet and heat through.",
      "ingredients": [
        {
          "item": "cooked breakfast sausage",
          "amount": 1,
          "unit": "cup"
        }
      ],
      "cookTime": {
        "amount": 2,
        "unit": "minutes"
      }
    },
    {
      "description": "Pour the egg mixture into the skillet and cook, stirring occasionally, until the eggs are set but still moist, about 3-4 minutes.",
      "cookTime": {
        "amount": 4,
        "unit": "minutes"
      }
    },
    {
      "description": "Warm the tortillas in the microwave for 30 seconds to make them more pliable.",
      "ingredients": [
        {
          "item": "large flour tortillas",
          "amount": 4,
          "unit": "whole"
        }
      ],
      "equipment": [
        {
          "item": "microwave-safe plate"
        }
      ],
      "cookTime": {
        "amount": 0.5,
        "unit": "minutes"
      }
    },
    {
      "description": "Divide the egg mixture evenly among the tortillas. Top each with 1/4 cup of shredded cheese and 2 tablespoons of salsa.",
      "ingredients": [
        {
          "item": "shredded cheese",
          "amount": 1,
          "unit": "cup"
        },
        {
          "item": "salsa",
          "amount": 0.5,
          "unit": "cup"
        }
      ]
    },
    {
      "description": "Fold the sides of each tortilla over the filling, then roll up from the bottom to form a burrito.",
      "prepTime": {
        "amount": 5,
        "unit": "minutes"
      }
    }
  ],
  "storage": "Wrap burritos in aluminum foil or plastic wrap and store in the refrigerator for up to 3 days. Reheat in the microwave for 1-2 minutes or in a skillet over medium heat until warmed through."
} 